<?xml version="1.0" encoding="UTF-8"?>

<library
    xmlns:xsi="http://www.w3.org/2001/XMLSchema-instance"
    xsi:noNamespaceSchemaLocation="library.xsd">
    <game>
        <title>Test</title>
        <shop>DRM-free</shop>
        <finished>Yes</finished>
        <installer>
            <system>Windows</system>
            <lastupdated>2017-07-14</lastupdated>
            <filename>win_file_1</filename>
            <filename>win_file_2</filename>
            <filename>win_file_3</filename>
        </installer>
        <installer>
            <system>Linux</system>
            <filename>lin_file_1</filename>
            <filename>lin_file_2</filename>
        </installer>
    </game>
    <game>
        <title>Test1</title>
        <shop>DRM-free</shop>
        <finished>No</finished>
    </game>
    <game>
        <title>a</title>
        <shop>DRM-free</shop>
        <finished>Yes</finished>
    </game>
    <game>
        <title>A</title>
        <shop>DRM-free</shop>
        <finished>No</finished>
    </game>
</library>
